{
  "schema_version": "source_spec/v0.1",
  "company": {
    "id": "mercedes-benz",
    "name": "Mercedes-Benz",
    "career_site": "https://jobs.mercedes-benz.com"
  },
  "platform": {
    "name": "beesite",
    "notes": "Mercedes-Benz runs on Beesite (jobstairs vendor). Identified via bundle.js baseURL pairs at /_nuxt/<hash>.js on the careers site."
  },
  "source_of_truth": "full_catalog",
  "open_closed_authoritative": true,
  "request": {
    "method": "POST",
    "url": "https://jobs.api.mercedes-benz.com/search",
    "headers": {
      "Accept": "application/json",
      "Content-Type": "application/json"
    },
    "body": {
      "LanguageCode": "EN",
      "SearchParameters": {
        "FirstItem": 1,
        "CountItem": 50,
        "Sort": [
          {
            "Criterion": "PublicationStartDate",
            "Direction": "DESC"
          }
        ]
      },
      "SearchCriteria": []
    },
    "templates": {
      "User-Agent": {
        "at": "headers.User-Agent",
        "value": "Mozilla/5.0 (Macintosh; Intel Mac OS X 10_15_7) AppleWebKit/537.36 (KHTML, like Gecko) Chrome/126.0 Safari/537.36"
      },
      "Referer": {
        "at": "headers.Referer",
        "value": "https://jobs.mercedes-benz.com/"
      },
      "Origin": {
        "at": "headers.Origin",
        "value": "https://jobs.mercedes-benz.com"
      }
    },
    "variables": {}
  },
  "language": {
    "default": "EN",
    "where": "body",
    "param": "LanguageCode"
  },
  "extraction": {
    "page_wrapper": {
      "items": "SearchResult.SearchResultItems",
      "total": "SearchResult.SearchResultCountAll"
    },
    "item_path": "SearchResult.SearchResultItems",
    "total_path": "SearchResult.SearchResultCountAll",
    "stable_id_path": "PositionID",
    "secondary_id_paths": [
      "ID"
    ],
    "title_path": "PositionTitle",
    "department_path": "DepartmentName",
    "organization_path": "ParentOrganizationName",
    "publication_date_path": "PublicationStartDate",
    "expiration_date_path": "PublicationEndDate",
    "official_url_path": "PositionURI",
    "apply_url_path": "ApplyURI.0",
    "language_path": "PublicationLanguage.Code",
    "preferred_language_codes": [
      "1"
    ],
    "date_format": "iso_date",
    "locations": {
      "path": "PositionLocation",
      "shape": "list_of_objects",
      "item_template": "{DisplayName}"
    },
    "description": {
      "path": "PositionFormattedDescription",
      "shape": "list_of_blocks",
      "tasks_relative_key": "Tasks",
      "qualifications_relative_key": "Qualifications",
      "join_separator": "\n\n",
      "strip_html": true
    }
  },
  "description_in_catalog": true,
  "paging": {
    "strategy": "offset",
    "page_size": 50,
    "first_page_value": 1,
    "page_param": "FirstItem",
    "inject": {
      "target": "body_path",
      "path": "SearchParameters.FirstItem"
    }
  },
  "completeness": {
    "rules": [
      {
        "name": "next_offset_ge_total",
        "kind": "next_offset_ge_total"
      },
      {
        "name": "items_path_empty_after_total",
        "kind": "items_path_empty_after_total"
      }
    ],
    "on_incomplete": "skip_closed"
  },
  "safety": {
    "sequential_only": true,
    "min_seconds_between_requests": 1.2,
    "long_pause_every_n_requests": 25,
    "long_pause_seconds": 6.0,
    "max_requests_per_run": 600,
    "abort_on_http_403": true,
    "abort_on_http_429": true,
    "max_retries_on_5xx": 1,
    "max_consecutive_errors": 8
  },
  "notes": "Full catalog source. Verified via single offline probe (--probe-full-catalog) that empty SearchCriteria returns SearchResultCountAll=2798. Description and qualifications are extracted from the catalog item via extraction.description (shape=list_of_blocks). Stable ID is PositionID. The catalog was once suspected of returning one PID in multiple language variants (DE/EN/HU), but 347 real catalog items inspected offline (mb/all_jobs_full.json: 114, mb/all_jobs_full2.json: 119, mb/all_jobs_raw.json: 114) show only PublicationLanguage Code 1 and zero duplicate PositionIDs, so preferred_language_codes is DECLARED_BUT_UNEXERCISED: the runtime does not read it and performs no cross-language dedup. Completeness is decided on traversed catalog items and page history, never on unique-job counts."
}